[
  {
    "geography": "48",
    "week": {
      "year": 2025,
      "week": 1
    },
    "cases": {
      "status": "reported",
      "count": 0
    },
    "case_definition": "confirmed_or_unknown_status",
    "provenance": [
      {
        "source_id": "synthetic-web-test",
        "url": "https://example.invalid/synthetic-web-test",
        "retrieved_at": "2026-10-07T00:00:00Z",
        "sha256": "3b61a0986c3f9aacfd79db78c3709232b430d04c2ad6454916417e7a4a0cae7f",
        "licence_id": "synthetic-test-only"
      }
    ]
  },
  {
    "geography": "48",
    "week": {
      "year": 2025,
      "week": 2
    },
    "cases": {
      "status": "reported",
      "count": 2
    },
    "case_definition": "confirmed_or_unknown_status",
    "provenance": [
      {
        "source_id": "synthetic-web-test",
        "url": "https://example.invalid/synthetic-web-test",
        "retrieved_at": "2026-10-07T00:00:00Z",
        "sha256": "3b61a0986c3f9aacfd79db78c3709232b430d04c2ad6454916417e7a4a0cae7f",
        "licence_id": "synthetic-test-only"
      }
    ]
  },
  {
    "geography": "48",
    "week": {
      "year": 2025,
      "week": 3
    },
    "cases": {
      "status": "reported",
      "count": 8
    },
    "case_definition": "confirmed_or_unknown_status",
    "provenance": [
      {
        "source_id": "synthetic-web-test",
        "url": "https://example.invalid/synthetic-web-test",
        "retrieved_at": "2026-10-07T00:00:00Z",
        "sha256": "3b61a0986c3f9aacfd79db78c3709232b430d04c2ad6454916417e7a4a0cae7f",
        "licence_id": "synthetic-test-only"
      }
    ]
  },
  {
    "geography": "48",
    "week": {
      "year": 2025,
      "week": 4
    },
    "cases": {
      "status": "reported",
      "count": 12
    },
    "case_definition": "confirmed_or_unknown_status",
    "provenance": [
      {
        "source_id": "synthetic-web-test",
        "url": "https://example.invalid/synthetic-web-test",
        "retrieved_at": "2026-10-07T00:00:00Z",
        "sha256": "3b61a0986c3f9aacfd79db78c3709232b430d04c2ad6454916417e7a4a0cae7f",
        "licence_id": "synthetic-test-only"
      }
    ]
  },
  {
    "geography": "48",
    "week": {
      "year": 2025,
      "week": 5
    },
    "cases": {
      "status": "reported",
      "count": 7
    },
    "case_definition": "confirmed_or_unknown_status",
    "provenance": [
      {
        "source_id": "synthetic-web-test",
        "url": "https://example.invalid/synthetic-web-test",
        "retrieved_at": "2026-10-07T00:00:00Z",
        "sha256": "3b61a0986c3f9aacfd79db78c3709232b430d04c2ad6454916417e7a4a0cae7f",
        "licence_id": "synthetic-test-only"
      }
    ]
  },
  {
    "geography": "48",
    "week": {
      "year": 2025,
      "week": 6
    },
    "cases": {
      "status": "reported",
      "count": 3
    },
    "case_definition": "confirmed_or_unknown_status",
    "provenance": [
      {
        "source_id": "synthetic-web-test",
        "url": "https://example.invalid/synthetic-web-test",
        "retrieved_at": "2026-10-07T00:00:00Z",
        "sha256": "3b61a0986c3f9aacfd79db78c3709232b430d04c2ad6454916417e7a4a0cae7f",
        "licence_id": "synthetic-test-only"
      }
    ]
  },
  {
    "geography": "48",
    "week": {
      "year": 2026,
      "week": 1
    },
    "cases": {
      "status": "reported",
      "count": 0
    },
    "case_definition": "confirmed_or_unknown_status",
    "provenance": [
      {
        "source_id": "synthetic-web-test",
        "url": "https://example.invalid/synthetic-web-test",
        "retrieved_at": "2026-10-07T00:00:00Z",
        "sha256": "3b61a0986c3f9aacfd79db78c3709232b430d04c2ad6454916417e7a4a0cae7f",
        "licence_id": "synthetic-test-only"
      }
    ]
  },
  {
    "geography": "48",
    "week": {
      "year": 2026,
      "week": 2
    },
    "cases": {
      "status": "reported",
      "count": 1
    },
    "case_definition": "confirmed_or_unknown_status",
    "provenance": [
      {
        "source_id": "synthetic-web-test",
        "url": "https://example.invalid/synthetic-web-test",
        "retrieved_at": "2026-10-07T00:00:00Z",
        "sha256": "3b61a0986c3f9aacfd79db78c3709232b430d04c2ad6454916417e7a4a0cae7f",
        "licence_id": "synthetic-test-only"
      }
    ]
  },
  {
    "geography": "48",
    "week": {
      "year": 2026,
      "week": 3
    },
    "cases": {
      "status": "reported",
      "count": 2
    },
    "case_definition": "confirmed_or_unknown_status",
    "provenance": [
      {
        "source_id": "synthetic-web-test",
        "url": "https://example.invalid/synthetic-web-test",
        "retrieved_at": "2026-10-07T00:00:00Z",
        "sha256": "3b61a0986c3f9aacfd79db78c3709232b430d04c2ad6454916417e7a4a0cae7f",
        "licence_id": "synthetic-test-only"
      }
    ]
  },
  {
    "geography": "40",
    "week": {
      "year": 2025,
      "week": 1
    },
    "cases": {
      "status": "reported",
      "count": 0
    },
    "case_definition": "confirmed_or_unknown_status",
    "provenance": [
      {
        "source_id": "synthetic-web-test",
        "url": "https://example.invalid/synthetic-web-test",
        "retrieved_at": "2026-10-07T00:00:00Z",
        "sha256": "3b61a0986c3f9aacfd79db78c3709232b430d04c2ad6454916417e7a4a0cae7f",
        "licence_id": "synthetic-test-only"
      }
    ]
  },
  {
    "geography": "40",
    "week": {
      "year": 2025,
      "week": 2
    },
    "cases": {
      "status": "reported",
      "count": 0
    },
    "case_definition": "confirmed_or_unknown_status",
    "provenance": [
      {
        "source_id": "synthetic-web-test",
        "url": "https://example.invalid/synthetic-web-test",
        "retrieved_at": "2026-10-07T00:00:00Z",
        "sha256": "3b61a0986c3f9aacfd79db78c3709232b430d04c2ad6454916417e7a4a0cae7f",
        "licence_id": "synthetic-test-only"
      }
    ]
  },
  {
    "geography": "40",
    "week": {
      "year": 2025,
      "week": 3
    },
    "cases": {
      "status": "reported",
      "count": 0
    },
    "case_definition": "confirmed_or_unknown_status",
    "provenance": [
      {
        "source_id": "synthetic-web-test",
        "url": "https://example.invalid/synthetic-web-test",
        "retrieved_at": "2026-10-07T00:00:00Z",
        "sha256": "3b61a0986c3f9aacfd79db78c3709232b430d04c2ad6454916417e7a4a0cae7f",
        "licence_id": "synthetic-test-only"
      }
    ]
  },
  {
    "geography": "40",
    "week": {
      "year": 2025,
      "week": 4
    },
    "cases": {
      "status": "reported",
      "count": 0
    },
    "case_definition": "confirmed_or_unknown_status",
    "provenance": [
      {
        "source_id": "synthetic-web-test",
        "url": "https://example.invalid/synthetic-web-test",
        "retrieved_at": "2026-10-07T00:00:00Z",
        "sha256": "3b61a0986c3f9aacfd79db78c3709232b430d04c2ad6454916417e7a4a0cae7f",
        "licence_id": "synthetic-test-only"
      }
    ]
  },
  {
    "geography": "40",
    "week": {
      "year": 2025,
      "week": 5
    },
    "cases": {
      "status": "reported",
      "count": 0
    },
    "case_definition": "confirmed_or_unknown_status",
    "provenance": [
      {
        "source_id": "synthetic-web-test",
        "url": "https://example.invalid/synthetic-web-test",
        "retrieved_at": "2026-10-07T00:00:00Z",
        "sha256": "3b61a0986c3f9aacfd79db78c3709232b430d04c2ad6454916417e7a4a0cae7f",
        "licence_id": "synthetic-test-only"
      }
    ]
  },
  {
    "geography": "40",
    "week": {
      "year": 2025,
      "week": 6
    },
    "cases": {
      "status": "reported",
      "count": 0
    },
    "case_definition": "confirmed_or_unknown_status",
    "provenance": [
      {
        "source_id": "synthetic-web-test",
        "url": "https://example.invalid/synthetic-web-test",
        "retrieved_at": "2026-10-07T00:00:00Z",
        "sha256": "3b61a0986c3f9aacfd79db78c3709232b430d04c2ad6454916417e7a4a0cae7f",
        "licence_id": "synthetic-test-only"
      }
    ]
  },
  {
    "geography": "40",
    "week": {
      "year": 2026,
      "week": 1
    },
    "cases": {
      "status": "reported",
      "count": 0
    },
    "case_definition": "confirmed_or_unknown_status",
    "provenance": [
      {
        "source_id": "synthetic-web-test",
        "url": "https://example.invalid/synthetic-web-test",
        "retrieved_at": "2026-10-07T00:00:00Z",
        "sha256": "3b61a0986c3f9aacfd79db78c3709232b430d04c2ad6454916417e7a4a0cae7f",
        "licence_id": "synthetic-test-only"
      }
    ]
  },
  {
    "geography": "40",
    "week": {
      "year": 2026,
      "week": 2
    },
    "cases": {
      "status": "reported",
      "count": 0
    },
    "case_definition": "confirmed_or_unknown_status",
    "provenance": [
      {
        "source_id": "synthetic-web-test",
        "url": "https://example.invalid/synthetic-web-test",
        "retrieved_at": "2026-10-07T00:00:00Z",
        "sha256": "3b61a0986c3f9aacfd79db78c3709232b430d04c2ad6454916417e7a4a0cae7f",
        "licence_id": "synthetic-test-only"
      }
    ]
  },
  {
    "geography": "40",
    "week": {
      "year": 2026,
      "week": 3
    },
    "cases": {
      "status": "reported",
      "count": 0
    },
    "case_definition": "confirmed_or_unknown_status",
    "provenance": [
      {
        "source_id": "synthetic-web-test",
        "url": "https://example.invalid/synthetic-web-test",
        "retrieved_at": "2026-10-07T00:00:00Z",
        "sha256": "3b61a0986c3f9aacfd79db78c3709232b430d04c2ad6454916417e7a4a0cae7f",
        "licence_id": "synthetic-test-only"
      }
    ]
  },
  {
    "geography": "35",
    "week": {
      "year": 2025,
      "week": 1
    },
    "cases": {
      "status": "reported",
      "count": 1
    },
    "case_definition": "confirmed_or_unknown_status",
    "provenance": [
      {
        "source_id": "synthetic-web-test",
        "url": "https://example.invalid/synthetic-web-test",
        "retrieved_at": "2026-10-07T00:00:00Z",